"product_id","summary"
"540039","Giáo Trình Chuẩn HSK 1 - Bài Học 
 Được chia thành 6 cấp độ với tổng cộng 18 cuốn, Giáo trình chuẩn HSK có những đặc điểm nổi bật sau: 
 • Kết hợp thi cử và giảng dạy: Được biên soạn phù hợp với nội dung, hình thức cũng như các cấp độ của đề thi HSK thật, bộ sách này có thể được sử dụng đồng thời cho cả hai mục đích là giảng dạy tiếng Trung Quốc và luyện thi HSK. • Bố cục chặt chẽ và khoa học: Các điểm ngữ pháp được giải thích cặn kẽ, phần ngữ âm và chữ Hán được trình bày từ đơn giản đến phức tạp theo từng cấp độ. 
 • Đề tài quen thuộc, nhiều tình huống thực tế: Bài học được thiết kế không quá dài và đề cập đến nhiều tình huống (có file MP3 kèm theo), giúp bạn rèn luyện các kỹ năng ngôn ngữ và tránh cảm giác căng thẳng trong lúc học. • Cách viết thú vị: Bằng cách viết sinh động kèm nhiều hình ảnh minh họa, tác giả bộ sách chỉ cho bạn thấy học tiếng Trung Quốc không hề khô khan, nhàm chán. 
 Với nhiều ưu điểm nổi bật như vừa nêu, Giáo trình chuẩn HSK không chỉ là tài liệu giảng dạy hữu ích ở các trung tâm dạy tiếng Trung Quốc mà còn rất thích hợp với những người muốn tự học ngôn ngữ này. 
 Lưu ý: Quét mã QR hoặc truy cập vào trang web phía sau sách để tải file MP3 Giá sản phẩm trên Tiki đã bao gồm thuế theo luật hiện hành. Bên cạnh đó, tuỳ vào loại sản phẩm, hình thức và địa chỉ giao hàng mà có thể phát sinh thêm chi phí khác như phí vận chuyển, phụ phí hàng cồng kềnh, thuế nhập khẩu (đối với đơn hàng giao từ nước ngoài có giá trị trên 1 triệu đồng)....."
"201004702","Tình Đầu Chọn Tôi, Tôi Rất Ngọt 
 - Bản Đặc Biệt : 1 Bookmark in 2 mặt và 1 postcard được kẹp trong sách (random chữ ký tay của tác giả)  1 standee và 1 poster ở bên ngoài 
 - Bản thường: Bìa mềm, 1 Bookmark in 2 mặt. 
 Giới thiệu nội dung: 
 Lâu Thành nhìn thẳng vào mắt cậu, nói vô cùng chân thành: “Từ trước đến giờ, anh chỉ từng thích một mình em thôi.” Chỉ có duy nhất một lần rung động, anh sẽ không nhận lầm. Anh lặp lại lần nữa: “Chỉ có một mình em thôi.” 
 “Lâu Thành, anh qua đây.” Đinh Tuyết Nhuận ngoắc tay, Lâu Thành chủ động sán lại gần. Cậu khẽ khàng thì thầm bên tai anh: “Anh không có cảm giác an toàn à?” 
 “Anh…” 
 Anh chưa kịp phủ nhận cậu đã cất lời an ủi: “Anh không cần phải sợ.” 
 Cửa kính đang mở hé, làn gió đêm lùa vào thổi tung mái tóc họ. Ánh đèn đường leo lét vụt qua gương mặt trắng nõn của Đinh Tuyết Nhuận, “Anh không cần phải đề phòng chuyện em thích người khác. Vì đã thích anh rồi, em sẽ không để tâm tới ai khác nữa đâu.” Giá sản phẩm trên Tiki đã bao gồm thuế theo luật hiện hành. Bên cạnh đó, tuỳ vào loại sản phẩm, hình thức và địa chỉ giao hàng mà có thể phát sinh thêm chi phí khác như phí vận chuyển, phụ phí hàng cồng kềnh, thuế nhập khẩu (đối với đơn hàng giao từ nước ngoài có giá trị trên 1 triệu đồng)....."
"109505434","Bạn Vẫn Tưởng Bạn có thể dự đoán được chính xác khả năng của mình ở mọi tình huống. Sự ThậT Là Về cơ bản thì bạn khá kém trong việc đánh giá khả năng của bản thân và độ khó của những công việc phức tạp. Hãy tưởng tượng rằng bạn chơi rất giỏi một trò nào đó. Trò nào cũng được - cờ vua, Street Fighter1, bài poker - không quan trọng. Bạn thường xuyên chơi trò này với lũ bạn và lúc nào cũng thắng. Bạn cảm thấy mình thật giỏi, và bạn tin rằng mình có thể giành chiến thắng ở một giải đấu nếu có cơ hội. Vậy là bạn lên mạng tìm xem giải đấu khu vực sẽ diễn ra ở đâu và khi nào. Bạn trả phí tham gia và rồi bị hạ đo ván ngay trong hiệp đầu tiên. Hóa ra là bạn không giỏi lắm đâu. Bạn cứ nghĩ rằng mình thuộc dạng đỉnh của đỉnh, nhưng mà thực chất bạn chỉ là một tay ngang thôi. Đây được gọi là hiệu ứng Dunning-Kruger, và nó là một phần cơ bản trong bản chất của con người. Hãy thử nghĩ về những ngôi sao Youtube mới nổi trong mấy năm gần đây - những người múa máy một cách vụng về với các loại vũ khí, hoặc là hát chẳng bao giờ đúng tông cả. Những màn trình diễn này thường rất tệ. Không phải họ cố tình dùng bản thân để mua vui cho người khác đâu. Trình độ của họ thực sự tệ, và chắc hẳn bạn cũng thắc mắc là tại sao lại có người có thể tự đặt mình lên một sân khấu toàn cầu với những màn trình diễn đáng xấu hổ như vậy. Vấn đề nằm ở chỗ họ không tưởng tượng được là công chúng toàn cầu có thể khắt khe và đòi hỏi cao hơn so với lượng khán giả nhỏ bé họ vốn đã quen thuộc là bạn bè, gia đình và những người đồng cấp. Như nhà triết học Bertrand Russell đã từng phải than thở: “Trong thế giới hiện đại ngày nay thì những kẻ khờ khạo luôn tự tin hết mức trong khi những người khôn ngoan thì lại luôn nghi ngờ.” Hiệu ứng Dunning-Kruger là lý do tại sao mà những chương trình như America’s Got Talent1 hay American Idol2 có thể diễn ra. Ở trong phòng karaoke với lũ bạn, bạn có thể là người hát hay nhất. Nhưng để đối chọi với các thí sinh trong cả một quốc gia? Khó lắm. *** Mời các bạn đón đọc Bạn Không Thông Minh Lắm Đâu của tác giả David McRaney."
"77225336","Sơ lược về tác phẩm 
 “Gió về khuya lạnh hơn, như gợi những niềm xa vắng. Vợ đặt hai cây bài xuống chiếu và cười: 
 - Kết đây, ông ơi! 
 - Kết gì? 
 - Tốt đen! Tôi ăn kết tốt đen đây! 
 Người chồng thở dài, làm ra bộ thua, nhưng một lát sau xòe ra hai cây tốt đỏ, không nói gì. Và người vợ đỏ mặt lên - hai má tươi như hoa đào. 
 - Thế là bị đè rồi! 
 Người chồng đắc ý cười vang, nhấp thêm một chút nước trà sen; đoạn, thong thả lấy ngón tay cái và ngón tay trỏ nhón một chiếc bánh xuân cầu màu hoàng yến đưa lên miệng” Giá sản phẩm trên Tiki đã bao gồm thuế theo luật hiện hành. Bên cạnh đó, tuỳ vào loại sản phẩm, hình thức và địa chỉ giao hàng mà có thể phát sinh thêm chi phí khác như phí vận chuyển, phụ phí hàng cồng kềnh, thuế nhập khẩu (đối với đơn hàng giao từ nước ngoài có giá trị trên 1 triệu đồng)....."
"204665316","Biographical sketches of Hò̂ Chí Minh, 1890-1969."
"1471887","Tớ Muốn Ăn Tụy Của Cậu
     
 
 
    “Tôi không biết về ngày mai của tôi - người vẫn còn thời gian, nhưng tôi đã nghĩ ngày mai của cô ấy - người chẳng còn mấy
    thời gian đã được hẹn trước.
 
 
    Cái lô-gíc xuẩn ngốc gì thế này.
 
 
    Tôi đã nghĩ thế giới này sẽ ưu ái trước sinh mệnh của một cô gái mà những ngày sống chẳng còn là bao.
 
 
    Đương nhiên, làm gì có chuyện như vậy. Đã không như vậy.
 
 
    Thế giới không phân biệt một ai.
 
 
    Nó không nương bàn tay tấn công bình đẳng ấy với bất kỳ ai, kể cả tôi - người có một thân thể khỏe mạnh, hay cô ấy - người
    sắp ra đi vì căn bệnh nan y.”
 Giá sản phẩm trên Tiki đã bao gồm thuế theo luật hiện hành. Bên cạnh đó, tuỳ vào loại sản phẩm, hình thức và địa chỉ giao hàng mà có thể phát sinh thêm chi phí khác như phí vận chuyển, phụ phí hàng cồng kềnh, thuế nhập khẩu (đối với đơn hàng giao từ nước ngoài có giá trị trên 1 triệu đồng)....."
"58213080","""Cuốn sách sẽ là lời giải đáp cho bạn những băn khoăn, trăn trở làm thế nào để nuôi dưỡng toàn diện 9 loại hình thông minh cho con. Cuốn sách là tâm huyết và kinh nghiệm của tác giả sau 26 năm trong nghề nuôi dạy trẻ, kết hợp cùng với phương pháp Montessori và thuyết đa trí tuệ của Tiến sĩ Howard Gardner (ĐH Harvard). Cuốn sách gồm 8 chương, 4 chương đầu giới thiệu về đặc điểm phát triển của trẻ giai đoạn 0 - 6 tuổi, giới thiệu về 9 loại hình thông minh và các thời kì nhạy cảm tương ứng để kích hoạt mỗi hình thông minh trong số đó. 4 chương sau sẽ giới thiệu đến độc giả 39 hoạt động thú vị để kích hoạt tiềm năng của con mà cha mẹ có thể áp dụng ngay tại nhà. Ứng với mỗi hoạt động tác giả đều ghi chú rõ thời gian nên thực hiện để đạt hiệu quả cao nhất. Cuốn sách không chỉ cung cấp cho bạn một cái nhìn toàn diện về sự phát triển của trẻ trong giai đoạn 0 - 6 tuổi mà còn cung cấp cho bạn những ý tưởng để quá trình nuôi dạy con trở nên thật nhẹ nhàng và hiệu quả."" --"
"173745189","Clean Code 
 Mã sạch và con đường trở thành lập trình viên giỏi 
 Hiện nay, lập trình viên là một trong những nghề nghiệp được nhiều người lựa chọn theo đuổi và gắn bó. Đây là công việc đòi hỏi sự tỉ mỉ, nhiều công sức nhưng mang lại giá trị cao và một tương lai công việc hứa hẹn. Là một trong số những chuyên gia giàu kinh nghiệm, điêu luyện và lành nghề trong ngành, tác giả đã đúc rút từ kinh nghiệm của mình, viết về những tình huống trong thực tế, đôi khi có thể trái ngược với lý thuyết để xây dựng nên cuốn cẩm nang này, nhằm hỗ trợ những người đang muốn trở thành một lập trình viên chuyên nghiệp.  Cuốn sách được nhiều lập trình viên đánh giá là quyển sách giá trị nhất mà họ từng đọc trong sự nghiệp của mình. Cuốn sách hướng dẫn cách để viết những đoạn mã có thể hoạt động tốt, cũng như truyền tải được ý định của người viết nên chúng. 
 Cuốn sách được chia thành ba phần lớn. Phần đầu tiên mô tả các nguyên tắc, mô hình và cách thực hành viết mã sạch. Phần thứ hai gồm nhiều tình huống điển hình với mức độ phức tạp gia tang không ngừng. Mỗi tình huống là một bài tập giúp làm sạch mã, chuyển đổi mã có nhiều vấn đề thành mã có ít vấn đề hơn. Và phần cuối là tuyển tập rất nhiều những dấu hiệu của mã có vấn đề, những tìm tòi, suy nghiệm từ thực tiễn được đúc rút qua cách tình huống điển hình. Giá sản phẩm trên Tiki đã bao gồm thuế theo luật hiện hành. Bên cạnh đó, tuỳ vào loại sản phẩm, hình thức và địa chỉ giao hàng mà có thể phát sinh thêm chi phí khác như phí vận chuyển, phụ phí hàng cồng kềnh, thuế nhập khẩu (đối với đơn hàng giao từ nước ngoài có giá trị trên 1 triệu đồng)....."
"113530804","Chờ Em Lớn Nhé Được Không? (Tái Bản)
  
 Giá sản phẩm trên Tiki đã bao gồm thuế theo luật hiện hành. Bên cạnh đó, tuỳ vào loại sản phẩm, hình thức và địa chỉ giao hàng mà có thể phát sinh thêm chi phí khác như phí vận chuyển, phụ phí hàng cồng kềnh, thuế nhập khẩu (đối với đơn hàng giao từ nước ngoài có giá trị trên 1 triệu đồng)....."
"195801686","El autor quiso exhibir el médico que hubiera deseado ser de no haber sido dibujante."
"104074993","Dance Dance Dance—a follow-up to A Wild Sheep Chase—is a tense, poignant, and often hilarious ride through Murakami’s Japan, a place where everything that is not up for sale is up for grabs. As Murakami’s nameless protagonist searches for a mysteriously vanished girlfriend, he is plunged into a wind tunnel of sexual violence and metaphysical dread. In this propulsive novel, featuring a shabby but oracular Sheep Man, one of the most idiosyncratically brilliant writers at work today fuses together science fiction, the hardboiled thriller, and white-hot satire."
"10379317","Nghệ thuật giao tiếp để thành công hướng tới mọi đối tượng độc giả, dù là sinh viên, nhân viên bán hàng, doanh nhân, nhà quản lý, chính trị gia hay người nội trợ hoặc bất cứ ai muốn kiểm soát các mối quan hệ, thu nhập hay cuộc đời họ theo cách hiệu quả hơn... Họ là người có công việc tốt nhất, có người bạn đời tuyệt vời nhất, có nhiều bạn bè tốt và... có tài khoản thật lớn trong ngân hàng. Vì sao họ đạt được những điều đó? Phải chăng họ có đôi tay của vua midas chạm vào bất cứ đâu mọi thứ đều biến thành vàng? Hay họ được ban tặng nhiều hơn? Không phải vậy. Nhiều người trong số họ không hề thông minh hơn, thậm chí cũng chẳng ưa nhìn hơn bạn! Sự thật những người thành đạt như vậy thường có khả năng giao tiếp, ứng xử khéo léo hơn người khác. Sự thật khác có thể khiến bạn ngạc nhiên là ai trong chúng ta cũng tiềm ẩn khả năng này, chỉ có điều là người có nhiều, người có ít mà thôi. Trong Nghệ thuật giao tiếp để thành công, với 92 thủ thuật đơn giản mà hiệu quả, Leil Lowndes sẽ giúp bạn khám phá và rèn luyện các kỹ năng để: • Tạo một khởi đầu ấn tượng và gặp được những người bạn muốn; • Hòa nhập linh hoạt vào bất cứ nhóm nào, dù giữa bạn và họ ít tương đồng đến đâu; • Sử dụng ngôn ngữ cơ thể để lôi cuốn người nghe; • Trở thành nhân vật trung tâm tại mọi bữa tiệc; • Luôn tự tin, đáng tin cậy và gây ảnh hưởng ở mọi nơi mà bạn đến."
"203757842","Năm 1990, phía bắc K 
 Có một thị trấn nhỏ được xây theo phong cách ngoại ô nước Mỹ, tên là Oregon. Nơi đây, cuộc sống của người dân vô cùng phong lưu, trù phú. Ngày nọ, một thiếu niên kì lạ bỗng xuất hiện. 
 Cậu ấy được vợ chồng nhà Sonoyama vốn không có con nhận về nuôi, tên cậu là Hitori. 
 Vẻ ngoài xinh xắn cộng thêm sự lanh trí của Hitori đã làm bố mẹ nuôi hết sức hài lòng. Nhưng bên trong Hitori lại mang theo một bí mật đáng sợ. Mục đích thật sự của cậu là gì? Giá sản phẩm trên Tiki đã bao gồm thuế theo luật hiện hành. Bên cạnh đó, tuỳ vào loại sản phẩm, hình thức và địa chỉ giao hàng mà có thể phát sinh thêm chi phí khác như phí vận chuyển, phụ phí hàng cồng kềnh, thuế nhập khẩu (đối với đơn hàng giao từ nước ngoài có giá trị trên 1 triệu đồng)....."
"41299108","Thế giới tâm linh và những bí mật bên kia cửa tử Sinh – lão – bệnh – tử là quy luật của đời người dù muốn hay không muốn con người vẫn phải trải qua. Vòng quay của quy luật ấy đối với mỗi con người có thể dài hay ngắn, nhưng có sinh, có tử là điều tất yếu. Đã là con người, cho dù đẹp đẽ hay xấu xa, giàu có hay nghèo hèn, khôn ngoan hay khờ dại thì chúng ta cũng không sao tránh khỏi sự chết. Thế nhưng nói đến sự chết ai cũng sợ, cũng chính vì sợ mà không đi sâu tìm hiểu và chuẩn bị về mặt tâm lý để chấp nhận nó một cách nhẹ nhõm. Thần chết luôn luôn bám đuổi cuộc sống con người như hình với bóng và có thể buộc cuộc sống của mỗi người dừng lại theo cách khác nhau . Dân gian có câu “chết chưa phải là hết”, nhưng lại chưa có những lời minh giải cho câu nói ấy, vì thế người người không hiểu được thực chất của cụm từ “chưa phải là hết”. Nếu chúng ta ai cũng hiểu biết tường tận về sự chết thì chết không phải là vấn đề đáng sợ nữa. Những chuyện có thật trong Trở Về Từ Cõi Sáng do Giáo sư Nguyên Phong biên soạn và dịch thuật, sẽ hé mở cánh cửa huyền bí tiết lộ cho bạn đọc vài điều bí mật về bên kia cửa tử. Một trong những bộ sách đặc biệt của Tây Tạng là bộ Tử Thư (Tibetian Book of the Death) viết về đời sống sau khi chết. Cuốn sách đã được nhiều người nghiên cứu và dịch thuật, nhưng vì nó quá hàm súc, khó hiểu nên một số học giả đã rút tỉa vài đoạn trong đó, khai triển rộng ra để an ủi những người đang đau khổ vì cảnh tử biệt. Cuốn sách “Trở Về Từ Cõi Sáng” do Nguyên Phong dịch, gồm nhiều câu chuyện của những người đã được trải nghiệm khoảnh khắc bước qua cửa tử rồi nhờ một phép màu nào đó được quay lại sự sống. Họ thấy gì ở bên kia cửa tử? Làm thế nào để khi chết không đau khổ? Những cách để giúp người mới qua đời; Khi rời thể xác linh hồn nhẹ nhàng như bay. Embraced by the Light (Trở Về Từ Cõi Sáng) của bà Betty Eadie, được Nguyên Phong giới thiệu: Xuất bản đầu năm 1992, nó đã trở nên một ""Best Seller"" với số bản kỷ lục và dẫn đầu những cuốn sách bán chạy nhất Hoa Kỳ. Bắt đầu từ tháng 2/1994, nó trở nên cuốn sách bán chạy nhất thế giới với 18 ấn bản bằng các thứ tiếng khác nhau. Trong ấn bản đầu tại Âu Châu, nhiều đọc giả đã phải mua giá chợ đen vì nhà xuất bản in không kịp. Tại Nhật Bản những người không muốn chờ đợi, đã xếp hàng để mua trước cửa nhà in… Tại sao cuốn sách này lại bán chạy như vậy? Theo các nhà bình luận thì không những nội dung cuốn sách này phong phú hơn nhiều cuốn sách tương tự mà tác giả, bà Betty Eadie, đã trải qua sự chết và kể lại những diễn tiến ở cõi bên kia, mà bà ta gọi là cõi sáng, một cách chi tiết rõ ràng. Sau khi cuốn sách xuất bản, tác giả đã được mời đi diễn thuyết khắp nơi, đâu đâu bà cũng thư hút được người nghe đông đảo chưa từng thấy. Nhiều đài phát thanh và truyền hình trên thế giới đã có chương trình phỏng vấn tác giả và thảo luận về hiện tượng ""người chết sống lại"". Đây là một đề tài đang được bàn cãi rất sôi nổi, người tin kẻ ngờ, và có người đã chất vấn tác giả từng chi tiết một nhưng bà Eadie đã giải đáp được hầu hết thắc mắc của mọi người nên số người hâm mộ bà ngày càng nhiều. Nhận thấy đây là một quyển sách giá trị, một đề tài đáng để cho chúng ta suy ngẫm First News Trí Việt đã mua bản quyền, biên dịch lại. Mong rằng cuốn sách sẽ giúp bạn đọc hiểu rằng sự chết không đem lại một thay đổi gì cho con người thật sự cả. Không thể nào một người vừa chết và trở nên một vị thánh, hay một bậc vĩ nhân, hiểu biết và có thể chi phối được mọi sự, mà chỉ là một người giống như trước khi chết một ngày hay một vài giờ mà thôi. Hiển nhiên, người đó cũng có tình cảm, kiến thức, sự hiểu biết, chỉ khác ở chỗ họ đã cởi bỏ bộ áo mặc trên người ra, cởi bỏ cái gánh nặng trên vai, bênh tật mệt nhọc của xác thân, và có cảm giác thảnh thơi tự tại. Cuốn sách cũng không chú trọng đến hiện tượng ""người chết sống lại"" vì đã có nhiều cuốn sách viết về đề tài này rồi và cũng không muốn đi vào chi tiết những cảnh giới tác giả đề cập ở cõi bên kia. Trong phần lược dịch này, chỉ đề cập đến nội dung của cuốn sách, hay thông điệp cần thiết cho nhân loại, mà tác giả đã nhấn mạnh rằng đó chính là lý do để trở lại cõi trần."
"27589910","Bố Xấu, Bố Tốt 
 Giới thiệu tác giả 
 
 David Walliams, sinh ngày 20/8/1971, là diễn viên hài kịch và nhà văn thiếu nhi nổi tiếng người Anh. Ông tốt nghiệp Đại học Bristol chuyên ngành Kịch nói vào năm 1992 và nổi tiếng từ chương trình hài kịch Little Britain của đài BBC. Ông từng góp mặt trong nhiều bộ phim và chương trình ti vi, trong đó có Doctor Who và Britain’s Got Talent. Walliams xuất bản tác phẩm thiếu nhi đầu tiên vào năm 2008. Kể từ đó đến nay, sách của ông đã được dịch ra 53 thứ tiếng và bán được hơn 23 triệu bản trên toàn thế giới. Ông đã từng giành 4 giải Specsavers National Book Awards qua các năm 2012, 2013 và 2014. 
 
 Lời nói đầu/Giới thiệu sách 
 
 Trên đời có đủ kiểu bố. Có bố béo và bố gầy, bố cao và bố thấp. 
 Có bố trẻ và bố già, bố thông minh và bố tối dạ. Có bố ngớ ngẩn và bố nghiêm túc, bố ồn ã và bố lặng lẽ. Và dĩ nhiên tất cả đều là những ông bố tốt. 
 Nhưng có thực như vậy? 
 
 Đối tượng sử dụng 
 
 Dành cho bé từ 7 tuổi 
 
 Tóm tắt nội dung 
 
 Câu chuyện kể về một cậu bé có một người bố rất đặc biệt. Bố của cậu bé có vẻ ngoài hơi đáng sợ với những hình xăm và một chiếc xe máy hầm hố. Tuy nhiên, bên trong vẻ ngoài ấy lại là một trái tim ấm áp và tình yêu thương vô bờ bến dành cho con trai. Cậu bé cùng bố trải qua những khoảnh khắc vui vẻ, đáng nhớ và từ đó nhận ra rằng bố mình luôn yêu thương và quan tâm đến mình. 
 
 Trích đoạn 
 
 
 Trích đánh giá và nhận xét 
 
 “Một câu chuyện kịch tính và ấm lòng sẽ khiến độc giả hồi hộp nhấp nhổm, có lúc cười thả ga, có lúc lại cảm động rơi nước mắt.” - HarperCollins 
 “Bố xấu, bố tốt là một câu chuyện táo bạo, xuất sắc và tuyệt đẹp. Cuốn sách chắc chắn sẽ chiếm một chỗ đứng vững chãi trong trái tim độc giả của Walliams.” - Ann-Janine Murtagh 
 
 Ưu điểm 
 
 Phù hợp với nhiều lứa tuổi:  Câu chuyện phù hợp với cả trẻ em và người lớn, giúp mọi người có những giây phút thư giãn và suy ngẫm. 
 Hình ảnh minh họa sinh động:  Các hình ảnh minh họa trong sách rất đẹp và ngộ nghĩnh, giúp trẻ dễ dàng hình dung ra câu chuyện. 
 Ngôn ngữ đơn giản, dễ hiểu:  Ngôn ngữ sử dụng trong sách rất đơn giản, dễ hiểu, giúp trẻ dễ dàng tiếp thu nội dung. 
 Giá sản phẩm trên Tiki đã bao gồm thuế theo luật hiện hành. Bên cạnh đó, tuỳ vào loại sản phẩm, hình thức và địa chỉ giao hàng mà có thể phát sinh thêm chi phí khác như phí vận chuyển, phụ phí hàng cồng kềnh, thuế nhập khẩu (đối với đơn hàng giao từ nước ngoài có giá trị trên 1 triệu đồng)....."
