"product_id","summary"
"145300494","THE MASTERY OF SELF   
 Hành trình thấu hiểu bản thân và tìm thấy tự do 
 The mastery of self - Một sự ra đời đầy đặc biệt 
 Vào những năm 900-1150 sau Công Nguyên, có một cộng đồng người tập hợp lại với nhau và hình thành một nền văn minh mới mà hiện nay nằm ở khu vực Trung Nam của Mexico. Họ tự gọi mình là người Toltec, trong đó Toltec có nghĩa là “nghệ sĩ”. Họ không phải là nghệ sĩ theo nghĩa thông thường (mặc dù vài người trong số họ là họa sĩ và nhà điêu khắc), mà họ tự xem mình là nghệ sĩ của cuộc đời, và thế giới này chính là tấm toan để họ vẽ nên tuyệt tác. Di sản của người Toltec và những lời dạy của họ đã được truyền lại từ thế hệ này sang thế hệ khác một cách bí mật vì bối cảnh chính trị thời bấy giờ. Don Miguel Ruiz Jr. là vị thầy xuất hiện gần đây nhất thuộc dòng dõi Eagle Knight của người Toltec. 
 Và như bạn đã thấy, cuốn sách này đã truyền tải chính xác thông điệp Hiểu Chính Mình, thậm chí còn hơn thế nữa. Miguel đã diễn giải tri thức cổ xưa theo ngôn ngữ hiện đại để chúng ta có thể vận dụng chân lý muôn thuở của việc thấu hiểu bản thân vào cuộc sống hằng ngày. 
 The mastery of self - Hành trình thấu hiểu bản thân và tìm thấy tự do cho chính mình 
 Trong những chương đầu tiên, Miguel đã đặt nền tảng cơ bản cho cuốn sách bằng cách đưa ra một khung tham chiếu chặt chẽ dựa trên phương pháp của người Toltec. Tác giả giải thích cho chúng ta thấy làm thế nào mà các sự kiện và hành động trong quá khứ có thể quyết định thực tại của chúng ta. Ở những chương tiếp theo, tác giả cung cấp các công cụ cần thiết để giúp chúng ta khám phá bản thân ở cấp độ sâu nhất, vạch trần những niềm tin sai sự thật mà chúng ta đã chấp nhận để rồi tự giới hạn chính mình, đồng thời giải phóng bản thân khỏi các bám chấp đang liên tục trói buộc ta. Các chương cuối cùng sẽ giúp chúng ta vạch ra một lộ trình mới hướng về nơi ta thực sự muốn đến, và đối với một vài người thì hướng đi mới này có thể rất khác so với hướng đi hiện tại. 
 Miguel nhiều lần nhấn mạnh rằng chỉ đọc sách thôi là không đủ, mà chúng ta cần phải áp dụng những kiến thức đó vào đời sống thì mới thực sự nhận được nhiều giá trị. Vì thế, Miguel đã đưa ra các bài tập thực hành ở cuối mỗi chương nhằm giúp chúng ta có thể áp dụng vào đời sống. Theo ngôn ngữ của người Hy Lạp thì kiến thức (logos) sẽ được thực hành (praxis) thông qua các bài tập. Hay nói cách khác, như Miguel từng viết rằng, “nắm bắt kiến thức chỉ là bước đầu tiên, thực hành kiến thức đó mới là bước khiến ta trở nên thành thạo”. 
 Và đó chỉ là một phần những giá trí mà cuốn sách The Mastery of Self – Hành trình thấu hiểu bản thân và tìm thấy tự do của tác giả Don Miguel Ruiz Jr. mang đến cho bạn. Sẽ còn rất nhiều điều hữu ích ở đây, đồng hành cùng bạn trên con đường khám phá và thấu hiểu bản thân đấy! Giá sản phẩm trên Tiki đã bao gồm thuế theo luật hiện hành. Bên cạnh đó, tuỳ vào loại sản phẩm, hình thức và địa chỉ giao hàng mà có thể phát sinh thêm chi phí khác như phí vận chuyển, phụ phí hàng cồng kềnh, thuế nhập khẩu (đối với đơn hàng giao từ nước ngoài có giá trị trên 1 triệu đồng)....."
"204363219","“Các cháu vẫn khỏe chứ? Mới đây vừa kỉ niệm 26 năm ngày ra mắt bộ truyện, và giờ loạt phim hoạt hình của Ninja Rantaro tại Nhật cũng bước vào năm thứ 20 rồi các cháu ạ. Mấy hôm trước có buổi nói chuyện với nhà biên kịch của phim, bác đã rất cảm phục nhiệt huyết học tập, sự đa tài và nhân cách đẹp của bác ấy. Bác Soubee tự nhủ mình cũng phải luôn luôn nỗ lực để ngày
 càng chín chắn, trưởng thành như các bạn ninja nhí của chúng ta vậy!!” - Soubee Amako Giá sản phẩm trên Tiki đã bao gồm thuế theo luật hiện hành. Bên cạnh đó, tuỳ vào loại sản phẩm, hình thức và địa chỉ giao hàng mà có thể phát sinh thêm chi phí khác như phí vận chuyển, phụ phí hàng cồng kềnh, thuế nhập khẩu (đối với đơn hàng giao từ nước ngoài có giá trị trên 1 triệu đồng)....."
"49910019","""Chào con! Ba mẹ đã sẵn sàng!"" - Cuốn sách không chỉ được viết trên nền tảng khoa học của một bác sĩ mà còn chứa chan tình yêu của một người mẹ. 
 
Chắc chắn bạn cũng sẽ cảm nhận được những điểm hay và thực tế trong quyển sách này, từ nền tảng khoa học vững chắc cho đến kiến thức chăm sóc trẻ mới nhất, và nhất là phù hợp với hoàn cảnh của Việt Nam. Giá sản phẩm trên Tiki đã bao gồm thuế theo luật hiện hành. Bên cạnh đó, tuỳ vào loại sản phẩm, hình thức và địa chỉ giao hàng mà có thể phát sinh thêm chi phí khác như phí vận chuyển, phụ phí hàng cồng kềnh, thuế nhập khẩu (đối với đơn hàng giao từ nước ngoài có giá trị trên 1 triệu đồng)....."
"67040913","Trong suốt hơn 20 thế kỷ qua, những lời dạy trong các văn bản linh thiêng cổ xưa đã khiến hầu hết mọi người hiểu nhầm. Chỉ có một số ít người trong lịch sử có thể nhận ra rằng nó thật ra là một câu đố, và một khi đã giải được ẩn ý trong câu đố ấy -  để vén bức màn bí mật - một thế giới hoàn toàn mới sẽ xuất hiện trước mắt bạn. 
 Trong quyển sách phép màu, Rhonda Byrne đã tiết lộ bí mật đầy quyền năng này cho cả thế giới. Và sau đó, với hành trình 28 ngày nhiệm màu, cô ấy hướng dẫn chúng ta phương pháp ứng dụng kiến thức này vào cuộc sống thường nhật. 
 Bất kể bạn là ai, bất kể bạn ở đâu, bất kể tình huống hiện tại của bạn là gì, phép màu sẽ thay đổi hoàn toàn cuộc sống của bạn! ( sách bìa mềm in đen trắng giấy nâu chống lóa Giá sản phẩm trên Tiki đã bao gồm thuế theo luật hiện hành. Bên cạnh đó, tuỳ vào loại sản phẩm, hình thức và địa chỉ giao hàng mà có thể phát sinh thêm chi phí khác như phí vận chuyển, phụ phí hàng cồng kềnh, thuế nhập khẩu (đối với đơn hàng giao từ nước ngoài có giá trị trên 1 triệu đồng)....."
"116406678","Quản Lý Nghiệp (Tái Bản 2021)
  Giá sản phẩm trên Tiki đã bao gồm thuế theo luật hiện hành. Bên cạnh đó, tuỳ vào loại sản phẩm, hình thức và địa chỉ giao hàng mà có thể phát sinh thêm chi phí khác như phí vận chuyển, phụ phí hàng cồng kềnh, thuế nhập khẩu (đối với đơn hàng giao từ nước ngoài có giá trị trên 1 triệu đồng)....."
"203763651","Peace Kentaro – cậu thiếu niên luôn nỗ lực trở thành một kĩ sư hàng đầu vẫn miệt mài cho ra đời những sáng chế mới với tinh thần sáng tạo tuyệt vời!! Có điều, đôi khi sự hăng hái quá đà lại khiến cậu chuốc lấy thất bại. Kentaro sẽ còn tiếp tục trưởng thành nhờ sự ủng hộ của mọi người quanh cậu!! Giá sản phẩm trên Tiki đã bao gồm thuế theo luật hiện hành. Bên cạnh đó, tuỳ vào loại sản phẩm, hình thức và địa chỉ giao hàng mà có thể phát sinh thêm chi phí khác như phí vận chuyển, phụ phí hàng cồng kềnh, thuế nhập khẩu (đối với đơn hàng giao từ nước ngoài có giá trị trên 1 triệu đồng)....."
"74460137","7 Thói Quen Của Bạn Trẻ Thành Đạt nhấn mạnh những gì chúng ta có được trong cuộc sống đều bắt nguồn từ những thói quen của chính mình. Ai cũng có những thói quen tốt và những thói quen xấu, và mỗi chúng ta phải rèn luyện những thói quen tốt và biết điều chỉnh, loại bỏ những thói quen xấu. Tuổi thiếu niên và trưởng thành là tuổi đẹp nhất và quan trọng nhất của đời người. Đây cũng là lứa tuổi mà các bạn trẻ bắt đầu khám phá cuộc sống với những ước mơ, khát vọng. Phía trước các bạn là những con đường bằng phẳng, êm ái; nhưng cũng có con đường quanh co, khúc khuỷu. Có con đường ngập tràn ánh sáng, cũng có con đường u ám, đầy cạm bẫy, nguy cơ. Nhưng làm cách nào để chọn được con đường đến đích thành công, hạnh phúc mà không lãng phí nhiều thời gian, công sức? Tất cả đều phụ thuộc vào tính cách và thói quen của các bạn. Có những thói quen đem đến sự thành công, hạnh phúc; nhưng cũng có những thói quen cản trở, phá hỏng sự phát triển của bạn. Cuốn sách phân tích tác động lớn lao của 7 thói quen quan trọng nhất của những bạn trẻ cần có. Đó là: Có thái độ sống tích cực; Biết định hướng tương lai; Việc hôm nay không để ngày mai; Tư duy cùng thắng; Biết lắng nghe để thấu hiểu và để được thấu hiểu; Có tinh thần hợp tác; Biết rèn luyện và phát triển những kỹ năng. Đây là những thói quen để các bạn tự rèn luyện bản thân và xây dựng các mối quan hệ của mình. Các thói quen này bổ sung và hỗ trợ chặt chẽ cho nhau, tạo một mắt xích bền vững giúp các bạn chọn lựa được hướng đi đúng đắn cho cuộc đời mình. Với phong cách ngắn gọn, vui tươi, dí dỏm, dễ hiểu, nhiều hình ảnh minh họa sinh động và dễ thương, 7 Thói Quen Của Bạn Trẻ Thành Đạt của Sean Covey đã được bạn đọc hoan nghênh và đón nhận nhiệt tình trên khắp thế giới. Đây là một trong những cuốn sách được các đọc giả trẻ yêu thích và đọc nhiều nhất, với số lượng phát hành lên đến hàng triệu bản trong một thời gian ngắn. Quả thật, 7 Thói Quen Của Bạn Trẻ Thành Đạt chính là chiếc la bàn, là kim chỉ nam giúp ta tránh được những thói quen tai hại nhằm xây dựng những thói quen tốt, hướng đến thành công. Đây không chỉ là một cuốn sách để đọc mà còn là một cẩm nang quý giá đưa bạn đến thành công, đạt được ước mơ của mình, xứng đáng với sự tin yêu của bạn bè, người thân, gia đình và xã hội."
"31509726","A charming and poignant story of young stirrings and lovely emotions of several youngsters who first experienced love and compassions... By a favorite writer of novels and stories for the young and the young-at-heart."
"148750882",""
"200694865","Đương sự sẽ được thông báo trước về cái chết của mình vỏn vẹn 24 giờ thông qua một tờ giấy báo tử với tên gọi “Ikigami”. Vậy 24 giờ cuối đời, họ sẽ trải qua như thế nào? Giá sản phẩm trên Tiki đã bao gồm thuế theo luật hiện hành. Bên cạnh đó, tuỳ vào loại sản phẩm, hình thức và địa chỉ giao hàng mà có thể phát sinh thêm chi phí khác như phí vận chuyển, phụ phí hàng cồng kềnh, thuế nhập khẩu (đối với đơn hàng giao từ nước ngoài có giá trị trên 1 triệu đồng)....."
"202851051","Bá Tước Tiểu Thư 
 Câu chuyện diễn ra ở Pháp vào cuối thế kỷ XIX, thời kì Phồn hoa tươi đẹp. Corinne, cô gái trong sáng, hoạt bát lớn lên trong trại trẻ mồ côi đã có một mối tình trong sáng với chàng quý tộc mù Richard. Bên cạnh đó, bạn của Richard, Vua báo chí tuổi trẻ tài cao Alain lại tha thiết yêu cô. 
 Khi Richard đến Paris phẫu thuật mắt, Corinne mới biết thân phận thực sự của mình là cháu gái Bá tước Ronsard. Trên đường đến Paris đoàn tụ người thân, con tàu chẳng may bị đắm, cướp đi trí nhớ của cô. Lợi dụng tai nạn ấy, ả móc túi Anna đã mạo danh Corinne, thế chỗ cô trở thành tiểu thư nhà Bá tướ 
 Đan xen giữa tình yêu và thù hận, lãng mạn và buồn thương, BÁ TƯỚC TIỂU THƯ - Series Manga cổ điển thập niên cũ hứa hẹn sẽ mang đến cho độc giả nhiều cung bậc cảm xúc qua nét vẽ trau chuốt, tỉ mỉ của Chieko Hosokawa & Fu~min - Bộ đôi đã sáng tác ""NỮ HOÀNG AI CẬP"" (Tên cũ) - Một trong những tác phẩm truyện tranh gắn liền với tuổi thơ của nhiều thế hệ độc giả. 
 Nhà xuất bản Kim Đồng xin trân trọng giới thiệu cùng bạn đọc. 
 
 Giá sản phẩm trên Tiki đã bao gồm thuế theo luật hiện hành. Bên cạnh đó, tuỳ vào loại sản phẩm, hình thức và địa chỉ giao hàng mà có thể phát sinh thêm chi phí khác như phí vận chuyển, phụ phí hàng cồng kềnh, thuế nhập khẩu (đối với đơn hàng giao từ nước ngoài có giá trị trên 1 triệu đồng)....."
"87226756","Cuốn sách là tập hợp những câu chuyện có thật của những số phận khác nhau đang gặp phải các vấn đề về tâm lý: trầm cảm, rối loạn lo âu, rối loạn lưỡng cực... và những người đang học tập và làm việc trong ngành tâm lý học. “Những đêm không ngủ, những ngày chậm trôi” là một khoảng lặng giữa những nốt nhạc vội vã chạy nhảy giữa cuộc sống hiện đại, để những con người dù mang trong mình những tổn thương tâm lý hay không đều cùng ngồi lại bên nhau, soi tỏ tâm hồn nhau bằng ánh sáng của sự thấu cảm, trao gửi cho nhau thương yêu và kết nối để chữa lành."
"78598381","Nối tiếp cuốn sách Best seller Tâm lý học hành vi, lần này Tủ sách Kiến thức về kỹ năng sống của Mintbooks xin giới thiệu tới bạn đọc cuốn bí kíp gây sốt Tâm lý học tính cách – tác phẩm được hàng triệu bạn trẻ Trung Quốc tìm đọc. 
 Với 312 trang sách, bạn sẽ khám phá ngay: 
 Nhập môn chín kiểu hình tính cách 
 Giúp phán đoán kiểu hình tính cách của chính mình 
 Nhìn thấu bản thân trong công việc, tình yêu và các mối quan hệ xã hội. 
 Trên thế giới này, có ai không quan tâm tới tính cách của mình? Chúng ta luôn muốn biết về tính cách của mình càng nhiều càng tốt. 
 Chắp bút bởi chuyên gia trong lĩnh vực tâm lý học - tiến sĩ Trâu Hoàng Minh, cuốn sách sẽ giới thiệu tới bạn đọc những tri thức và kĩ năng cần thiết trong việc phân tích tính cách con người. 
 “Tâm lý học tính cách” lấy “chín kiểu hình tính cách” làm trọng tâm, với nền tảng là những lý luận của tâm lý học tính cách và tâm lý học chiều sâu , giới thiệu đến bạn đọc một cách chi tiết về đặc trưng và phương pháp cải thiện khuyết điểm dành cho chín kiểu hình tính cách của con người. 
 Với ngôn từ dễ hiểu, ví dụ sinh động cùng nội dung chi tiết mang tính xác thực cao, tôi tin rằng cuốn sách này không chỉ giúp bạn đọc nhận thức được kiểu hình tính cách của bản thân, mà quan trọng hơn là giúp các bạn phát huy sở trường, đồng thời khắc phục khiếm khuyết của chính mình. 
 Có thể nói, cuốn sách này cung cấp cho độc giả công cụ hữu ích để tự hoàn thiện tính cách. Qua đây, tác giả hy vọng mỗi người đều may mắn mở được cánh cửa lớn hướng về cuộc sống hạnh phúc cá nhân. Giá sản phẩm trên Tiki đã bao gồm thuế theo luật hiện hành. Bên cạnh đó, tuỳ vào loại sản phẩm, hình thức và địa chỉ giao hàng mà có thể phát sinh thêm chi phí khác như phí vận chuyển, phụ phí hàng cồng kềnh, thuế nhập khẩu (đối với đơn hàng giao từ nước ngoài có giá trị trên 1 triệu đồng)....."
"179735872","Trong cuộc sống thường nhật, nếu tâm trí của bạn luôn bị chi phối bởi những suy nghĩ tiêu cực như không biết người khác nghĩ gì về mình, mọi hành động và lời nói của mình sẽ khiến mọi người cảm thấy ra sao, nếu không hoàn thành tốt công việc thì hậu quả sẽ như thế nào… thì chứng tỏ bạn đang có những dấu hiệu của một người nhạy cảm, và đây chính là cuốn sách dành cho bạn.
 Việc chúng ta để tâm đến cảm xúc của chính mình và ý kiến của người khác là điều rất tốt, bởi nó sẽ giúp chúng ta gắn kết bản thân với thế giới xung quanh. Song nếu tính nhạy cảm quá cao, chúng ta sẽ rất dễ tức giận, buồn rầu, sợ hãi và tổn thương, gây ảnh hưởng không nhỏ tới chất lượng cuộc sống, các mối quan hệ cũng như khiến chúng ta không đủ tự tin để phát huy hết năng lực của bản thân. 
 Cuốn sách này là tổng hợp những phương pháp vô cùng hiệu quả được viết bởi một bác sỹ - chuyên gia tâm lý học hàng đầu Nhật Bản giúp bạn làm chủ vô vàn cảm xúc của chính mình, cũng như cách thức để bạn luôn có được trạng thái thân an tâm lạc thay vì rơi vào vòng xoáy bế tắc dù là trong bất cứ hoàn cảnh nào. Hy vọng qua cuốn sách này, bạn sẽ buông bỏ được mọi âu lo, sống đúng với con người mình và có một cuộc đời an yên, hạnh phúc. 
 Trích dẫn trong sách: 
 Chỉ khi tâm hồn được thanh thản, chúng ta mới có thể phát huy được tối đa sức mạnh vốn có của bản thân cũng như tạo dựng được sự gắn kết với chính mình và người khác. 
 Đừng để nỗi bất an quẩn quanh trong tâm trí và tự vật lộn với nó, bởi chắc chắn điều ấy sẽ làm cho bạn càng lúc càng căng thẳng. Còn nếu biết cách vừa chia sẻ tâm sự với người khác, vừa điều chỉnh lại cách nghĩ của bản thân, có khi bạn sẽ nhận thấy những điều mình vốn đang băn khoăn hóa ra lại chẳng hề to tát như bạn đang tưởng tượng. Giá sản phẩm trên Tiki đã bao gồm thuế theo luật hiện hành. Bên cạnh đó, tuỳ vào loại sản phẩm, hình thức và địa chỉ giao hàng mà có thể phát sinh thêm chi phí khác như phí vận chuyển, phụ phí hàng cồng kềnh, thuế nhập khẩu (đối với đơn hàng giao từ nước ngoài có giá trị trên 1 triệu đồng)....."
"13333355","Bạn có nhớ hồi nhỏ mình từng đọc truyện tranh không? Và giờ nếu ai đó hỏi lại bạn nội dung của một bộ truyện tranh nào đó, chắc chắn bạn có thể kể một lèo gần như từ A – Z. Nhưng nếu ai đó hỏi bạn nội dung của một cuốn sách nào đó bạn đã đọc chừng một năm thì gần như bạn chẳng nhớ gì hoặc quá lắm chỉ nhớ được vài ý chính. Giờ thì chắc bạn đang cười vì: “Ồ, đúng rồi, sao lại có thể như vậy được nhỉ?”  
 Nguyên nhân là: 
 Khi đọc một quyển sách khiến bạn hạnh phúc, vui vẻ, thậm chí bất an hay lo sợ, những hóc-môn liên quan đến mỗi loại cảm xúc này sẽ được não tiết ra và và khiến bạn nhớ lâu hơn. Và đối với bất kỳ sự kiện nào xảy ra trong đời bạn cũng thế. Đó là lý do bạn không thể quên được anh chàng mình từng hẹn hò từ thời cấp ba hay cảm giác của nụ hôn đầu đời dù là sau hàng chục năm. Tất cả đều đã được khoa học chứng thực. Vì thế, Đọc nhiều nhớ được bao nhiêu? không phải là lý thuyết nói suông mà đã được kiểm chứng hẳn hoi.  
 Nếu bạn muốn nhớ lâu và tích lũy được thật nhiều kiến thức để phát triển bản thân, cuốn sách này sẽ chỉ bạn cách để làm điều đó. 
   Giá sản phẩm trên Tiki đã bao gồm thuế theo luật hiện hành. Bên cạnh đó, tuỳ vào loại sản phẩm, hình thức và địa chỉ giao hàng mà có thể phát sinh thêm chi phí khác như phí vận chuyển, phụ phí hàng cồng kềnh, thuế nhập khẩu (đối với đơn hàng giao từ nước ngoài có giá trị trên 1 triệu đồng)....."
