"product_id","summary"
"44433397","Tình yêu bản thân là sự cân bằng giữa việc chấp nhận con người thật của chính mình, song song với việc biết rằng mình xứng đáng với những điều tốt đẹp hon, và hành động theo kim chỉ nam đó. Tác giả truyền cảm hứng Yêu mình trước đã, yêu đời để sau  được chấp bút bởi Vex King - một nhà văn, một huấn luyện viên tinh thần và một doanh nhân – người đã trải qua vô vàn thử thách trong quá trình trưởng thành. Anh từng sống dưới đáy của cuộc đời khi cha anh qua đời từ khi anh còn là một đứa trẻ, từng trải qua thời gian sống vô gia cư và lớn lên trong một khu phố nhiều tệ nạn. Anh cũng thường xuyên bị bắt nạt do nạn phân biệt chủng tộc.  
 Tuy nhiên, Vex vẫn vươn lên mạnh mẽ và thành công trong cuộc sống. Tài khoản Instagram cá nhân của anh (@vexking) đã trở thành nguồn cảm hứng của hàng ngàn người trẻ. Anh là người bắt đầu phong trào ""Good Vibes Only #GVO"" để giúp người khác sử dụng sức mạnh của sự tích cực để biến đổi bản thân và cuộc sống của họ thành một điều gì đó vĩ đại hơn. 
 Cuốn sách cần một sự kết hợp qua lại giữa nội dung cuốn sách và cam kết của người đọc 
 ""Yêu mình trước đã, yêu đời để sau"" đòi hỏi bạn phải cam kết ngay bây giờ để trở thành phiên bản tốt hơn, vĩ đại hơn của chính mình. Mục tiêu của nó là giúp bạn trở nên tốt hơn so với chính bạn ngày hôm qua, mỗi ngày, trong mọi lĩnh vực, và trong suốt phần đời còn lại của bạn.  
 Sự vĩ đại không phải là khái niệm một chiều. Mặc dù xét về mặt chủ quan, hầu hết mọi người sẽ liên tưởng khái niệm này với việc có một khả năng đặc biệt, có nhiều tiền hoặc của cải vật chất, quyền lực hoặc địa vị, và những thành tựu to lớn mà họ đã đạt được qua nhiều quá trình nỗ lực, đấu tranh. Nhưng sự vĩ đại thực sự sâu sắc hơn như vậy rất nhiều. Sự vĩ đại không thể tồn tại nếu thiếu đi mục đích, tình yêu, lòng vị tha, sự khiêm tốn, sự trân trọng, lòng nhân hậu, và tất nhiên – đặc ân lớn nhất mà con người được ban tặng – niềm hạnh phúc. 
 Bạn xứng đáng với một cuộc sống tốt đẹp hơn và cuốn sách này sẽ giúp bạn tạo ra cuộc sống đó ! Giá sản phẩm trên Tiki đã bao gồm thuế theo luật hiện hành. Bên cạnh đó, tuỳ vào loại sản phẩm, hình thức và địa chỉ giao hàng mà có thể phát sinh thêm chi phí khác như phí vận chuyển, phụ phí hàng cồng kềnh, thuế nhập khẩu (đối với đơn hàng giao từ nước ngoài có giá trị trên 1 triệu đồng)....."
"173763072","Đây là eBook tổng hợp các bài viết trong chuyên mục Tâm sự của báo VnExpress. Một eBook rất hay, cho ta nhiều điều để suy ngẫm, để cho ta đưa ra những ứng xử tốt nhất trong cuộc sống. Mời các bạn đón đọc."
"204985083","“GIA ĐỊNH LÀ NHỚ, SÀI GÒN LÀ THƯƠNG” “Sài Gòn” và “Gia Định”, cả hai cái tên thân thương này đều đã không còn được sử dụng như tên chính thức của vùng đất mà ngày nay là Thành phố Hồ Chí Minh. Tuy vậy, mỗi tên gọi đều gợi lên những ký ức, hoài niệm khác nhau đối với mỗi người dân thành phố này. Gia Định là nhớ, Sài Gòn là thương được chia làm hai phần như một thước phim xuyên suốt với hai màu sắc khác nhau. Nếu phần “Gia Định là nhớ” như một thước phim trắng đen ghi lại khung cảnh sơ khai của vùng Gia Định lúc người Pháp vừa đặt chân đến; thì trái lại, phần “Sài Gòn là thương” lại như một thước phim màu miêu tả một Sài Gòn náo nhiệt, phồn hoa, đầy sức sống từ cuối thập niên 1950 đến ngày hôm nay. Trong phần 1, “Sài Gòn là thương”, khởi đầu từ đường Nguyễn Huệ - một trong những con đường lâu đời của Sài Gòn, tác giả, nhà báo Cù Mai Công dẫn dắt bạn đọc phát hiện nhiều điều mới mẻ về nguồn gốc của chợ Bến Thành, về nếp sinh hoạt người Sài Gòn xưa. Và bạn cũng sẽ được khám phá về “chợ Cũ” có tuổi đời hơn nửa thế kỷ. Đặc sắc nhất là mảng ẩm thực của cả ba nền văn hóa Việt, Hoa, Pháp như cà phê dĩa, thịt quay bánh mì, cơm thố… qua lời miêu tả hấp dẫn của tác giả sẽ khiến cho bạn… phát thèm. Trái ngược với không khí phố chợ náo nhiệt của đường Nguyễn Huệ là một không gian xanh mát, yên tĩnh của đường Phạm Ngọc Thạch, vốn là “khung trời đại học” nổi tiếng trong thi ca trước 1975. Với cách kể chuyện sinh động và tài tình của một nhà báo, tác giả tiếp tục dẫn bạn đi vào những câu chuyện cũ qua hồi ức của những cư dân lâu đời sống gần khu vực hồ Con Rùa, hoặc qua những kỷ niệm, tình yêu tuổi học trò của những cựu sinh viên trường Luật, Kiến trúc, Văn khoa… Sống đủ lâu tại thành phố này, ắt hẳn ai cũng sẽ ít nhiều thắc mắc: Tại sao Sài Gòn lại ngập nước mỗi khi trời mưa lớn? Tại sao Sài Gòn gắn liền với những con hẻm nhỏ ngoằn nghèo chẳng theo một trật tự quy hoạch nào? Tại sao vẫn còn nhiều căn nhà sàn trên các kinh rạch giữa một thành phố từng được mệnh danh là “hòn ngọc Viễn Đông”? Trong phần 2, “Gia Định là nhớ”, bạn sẽ hiểu được căn nguyên của nhiều vấn đề “thời sự” ngày nay của thành phố này. Cụ thể, loạt bài về quy hoạch Sài Gòn - Chợ Lớn - Gia Định sẽ cho bạn đọc hình dung được cái nhìn toàn cảnh theo dòng thời gian về hình dáng của Sài Gòn từ những ngày đầu cho đến nay: từ những trục đường cơ bản đầu tiên của công trình sư Trần Văn Học bao quanh thành Phiên An, rồi người Pháp loay hoay với nhiều đề án quy hoạch dẫn đến việc liên tục đào lấp các kinh rạch, cho đến tình trạng “tự quy hoạch” của người dân tại Sài Gòn sau năm 1965 khi cuộc chiến tranh leo thang… Không chỉ về quy hoạch đường xá, bạn đọc còn được biết thêm về kiến trúc đặc trưng của Sài Gòn trước 1975 qua các phân đoạn viết về những công trình tiêu biểu của văn phòng kiến trúc sư Nguyễn Văn Hoa, hoặc hồ Con Rùa với thiết kế độc đáo của kiến trúc sư Nguyễn Kỳ. Và những ai đã từng yêu mến Cù Mai Công qua những bài viết về Ông Tạ, Tân Bình (khu vực tác giả sinh ra và lớn lên) sẽ tiếp tục được thỏa mãn với loạt ba bài viết về Nhà thờ Chí Hòa, Rạch Nhiêu Lộc và Rừng cao su cuối cùng của Sài Gòn - Gia Định với lượng thông tin quý hiếm và chi tiết đến không ngờ. Không chỉ là nhân chứng sống một thời của Sài Gòn, tác giả còn là một nhà nghiên cứu “có hạng” khi có nhiều phát hiện bất ngờ, mới mẻ từ kho tư liệu cũ. Và trong suốt quyển sách “Gia Định là nhớ, Sài Gòn là thương”, bạn đọc hẳn sẽ nhận ra rằng dù là bài viết về “sân nhà” Ông Tạ hay về khu Sài Gòn, Chợ Lớn, Thủ Đức, hình như ta thấy không có nơi nào trong thành phố này mà chưa từng có bước chân của Cù Mai Công. Như nhà nghiên cứu Phạm Công Luận - người bạn thuở thiếu thời của tác giả - đã nhận xét, Cù Mai Công là “một người am hiểu thành phố, sống thường xuyên trên đường phố từ sáng sớm đến tối mịt, từ thời trai trẻ tới giờ…” hoặc như lời cảm nhận của nhà báo Phúc Tiến dành cho người bạn của mình: “Ôi, Công của tôi, một cây bút “sống” được, viết được nhiều kiếp người như thế, không nhiều lắm đâu…”."
"207494302","Băng Hải tặc Mũ Rơm, Hải quân và đông đảo người hâm mộ đã cùng tề tựu trong buổi biểu diễn trực tiếp của Uta – nanfgn công chúa âm nhạc khiến cả thế giới say đắm! Tại đây, tất cả đã phát hiện một sự thật chấn động, rằng “Uta là con gái của Shanks”, vén màn cho một trận chiến khuynh đảo đại dương! 
 Bom tấn điện ảnh kỉ niệm 25 năm ra đời tác phẩm nay đã được chuyển thể thần tốc thành tiểu thuyết, sẵn sàng chinh phục các độc giả! 
 
 Giá sản phẩm trên Tiki đã bao gồm thuế theo luật hiện hành. Bên cạnh đó, tuỳ vào loại sản phẩm, hình thức và địa chỉ giao hàng mà có thể phát sinh thêm chi phí khác như phí vận chuyển, phụ phí hàng cồng kềnh, thuế nhập khẩu (đối với đơn hàng giao từ nước ngoài có giá trị trên 1 triệu đồng)....."
"177321527","Kinh tế thế giới đến năm 2030 sẽ có những phát triển như thế nào? Thế giới sẽ thay đổi ra sao? Vị thế của Mỹ, Trung Quốc trong thời đại mới? Chiến tranh thương mại Mỹ – Trung liệu còn tiếp diễn? Điều kiện để trở thành một cường quốc trong tương lai? Nhật Bản nên giao thiệp với các “cường quốc trong tương lai” như thế nào? Tất cả sẽ được Hamada Kazuyuki, học giả Kinh tế-Chính trị nổi tiếng của Nhật Bản, diễn giải, phân tích một cách rõ ràng, đầy đủ trong Cường quốc trong tương lai – Vẽ lại bản đồ thế giới năm 2030. Quyển sách được xem là “tập bản đồ thế giới tương lai” dự đoán về một thế giới sắp đến. Trong cuốn sách, Hamada Kazuyuki cũng dành hẳn một phần để luận bàn về kinh tế Việt Nam. Việt Nam được đánh giá là quốc gia có nền kinh tế phát triển nổi bật nhất ở châu Á. Với dân số trẻ, tầng lớp thượng lưu ngày càng nhiều, thị trường quốc nội phát triển nhanh chóng, thêm vào đó là tinh thần vượt lên nghịch cảnh, biến đau thương thành sức mạnh, cùng một chiến lược ngoại giao khôn khéo… Việt Nam có đủ tham vọng, tầm nhìn và năng lực chuyển mình thành cường quốc trong tương lai, thách thức các cường quốc hiện tại. Cuốn sách này sẽ phù hợp với những độc giả quan tâm nghiên cứu về lĩnh vực kinh tế, về sự biến động trong tương lai của kinh tế thế giới nói chung và sự phát triển của kinh tế Việt Nam nói riêng."
"130233544","Nếu loài mèo quay sang hứng thú với triết học thì đây sẽ là một nhánh thú vị của trường phái hư cấu kì khôi. Thay vì coi đây là liều thuốc chữa chứng lo âu, những triết gia mèo sẽ tham gia vào môn triết học như thể đây là một trò chơi vậy. 
 Nhưng loài mèo không cần triết học. Tuân theo bản chất tự nhiên của mình, chúng hài lòng với những gì cuộc sống đem lại. Loài người thì ngược lại, họ bất mãn với bản chất của mình như thể đó là điều tự nhiên. Bất chấp những kết cục bi thảm và kì khôi có thể đoán trước được, loài động vật mang tên “con người” không bao giờ từ bỏ việc nỗ lực trở thành một thứ gì đó không phải là mình. 
 Đa số cuộc đời con người là sự chật vật đấu tranh tìm kiếm hạnh phúc. Đối với loài mèo, ngược lại, hạnh phúc là trạng thái mặc định khi những mối đe doạ thực tế nhăm nhe sự tồn tại tốt đẹp của chúng bị loại bỏ. Có lẽ đây là lý do chính mà nhiều người trong số chúng ta yêu loài mèo. Ngay từ khi sinh ra, chúng đã sở hữu niềm hạnh phúc mà con người thường không đạt được.  Những chú mèo không cần phải bận tâm xem xét cuộc đời chúng, bởi chúng chẳng hề nghi ngờ chuyện cuộc đời này có đáng sống hay không. Sự tự ý thức của con người đã tạo ra tình trạng bất ổn vĩnh viễn mà triết học đã luôn cố gắng chạy chữa, nhưng vô ích. 
 Mèo không lên kế hoạch cho cuộc đời; mà sống cuộc sống xảy đến với chúng. Con người thì lại không thể ngừng biến cuộc đời mình thành một câu chuyện. Nhưng vì họ không thể biết cuộc đời mình sẽ kết thúc như thế nào, nên cuộc sống đã làm gián đoạn câu chuyện mà họ cố gắng kể. Vì vậy, con người đến cuối cùng lại sống như những chú mèo, một cách hết sức tình cờ. 
 Cuốn sách cho chúng ta một cái nhìn so sánh về cuộc đời của loài mèo và cuộc đời loài người, từ đó để bạn tự nhận ra bản thân đang “lầm đường lạc lối” trong những toan tính của cuộc sống và tự tìm ra con đường bước tới ánh sáng của sự “biết” và “đủ”. 
 
 => Các trích dẫn hay trong sách: 
 “Mèo có một bản chất phân biệt chúng với các sinh vật khác – ngay cả với chúng ta. Bản chất của loài mèo, và cũng chính là điều chúng ta có thể học được từ chúng, là chủ đề của cuốn sách này. Không một ai từng chung sống với loài mèo có thể coi chúng là những cá thể có thể hoán đổi cho nhau của một loài duy nhất. Mỗi chú mèo đều là đơn nhất và mang tính cá thể hơn so với rất nhiều con người. 
 Những chú mèo không cần phải bận tâm xem xét cuộc đời chúng, bởi chúng chẳng hề nghi ngờ chuyện cuộc đời này có đáng sống hay không. Sự tự ý thức của con người đã tạo ra tình trạng bất ổn vĩnh viễn mà triết học đã luôn cố gắng chạy chữa, nhưng vô ích.” 
 “Mèo hạnh phúc khi được là chính mình, trong khi con người cố gắng [trở nên] hạnh phúc bằng cách thoát khỏi bản thân.  Nhưng những người yêu mèo không yêu mèo vì họ nhận ra bản thân mình trong chúng. Họ yêu mèo vì mèo rất khác với họ.Không giống như chó, mèo chưa mang “tính người” trong mình. Chúng tương tác với chúng ta và có thể yêu chúng ta theo cách riêng của mình, nhưng ở tầng sâu thẳm nhất, chúng khác chúng ta. Khi bước vào thế giới con người, loài mèo cho phép chúng ta nhìn xa hơn. Không còn bị mắc kẹt trong chính những suy nghĩ của mình, chúng ta có thể học được từ loài mèo lý do tại sao công cuộc theo đuổi hạnh phúc đầy căng thẳng của chúng ta nhất định sẽ thất bại.” 
 “Loài mèo dành phần lớn cuộc đời mình trong sự cô đơn đầy mãn nguyện. Vì mọi thứ đều cố gắng tồn tại như những dạng cụ thể của nó, nên không ai có thể thực sự muốn ngừng tồn tại cả. Không ai muốn kết thúc cuộc đời mình: kẻ tự sát là kẻ bị cả thế giới giết chết. Như Spinoza đã đặt nó trong cuốn Đạo đức học: ”Không có gì có thể tự phá hủy, trừ khi [bị tác động] bởi một nguyên nhân bên ngoài”. 
 “Là những kẻ săn mồi, phát triển khả năng đồng cảm lên mức độ cao sẽ gây rối loạn chức năng đối với mèo. Đó là lý do tại sao chúng thiếu năng lực này. Đó cũng là lý do tại sao niềm tin phổ biến cho rằng mèo là loài độc ác bị coi là sai lầm. Sự tàn nhẫn là sự đồng cảm ở dạng tiêu cực. Trừ khi bạn cảm nhận vì người khác, bạn không thể vui sướng trước nỗi đau của người khác. Con người thể hiện sự đồng cảm tiêu cực này khi họ hành hạ mèo vào thời trung cổ. Ngược lại, khi mèo vờn một con chuột bị bắt, chúng sẽ không thích thú với sự dày vò đó. Việc vờn con mồi thể hiện bản chất săn mồi của chúng. Thay vì tra tấn những sinh vật nằm dưới quyền lực của mình – một xu hướng đặc biệt chỉ có ở con người – mèo chỉ đơn giản là đang chơi với những con mồi.” Giá sản phẩm trên Tiki đã bao gồm thuế theo luật hiện hành. Bên cạnh đó, tuỳ vào loại sản phẩm, hình thức và địa chỉ giao hàng mà có thể phát sinh thêm chi phí khác như phí vận chuyển, phụ phí hàng cồng kềnh, thuế nhập khẩu (đối với đơn hàng giao từ nước ngoài có giá trị trên 1 triệu đồng)....."
"198415075","Để người dân thấu hiểu giá trị sinh mệnh, một đạo luật mang tên “Luật duy trì phồn thịnh quốc gia” đã được ban hành. Luật quy định, khi một người vào tiểu học sẽ được tiêm một loại vắc xin và có tỉ lệ 1/1000 chứa viên nang nano đặc biệt. Viên nang này ở trong cơ thể người được tiêm và phát nổ khi họ bước vào ngưỡng tuổi 18 – 24. Đương sự sẽ được thông báo trước về cái chết của mình vỏn vẹn 24 giờ thông qua một tờ giấy báo tử với tên gọi “Ikigami”. Vậy 24 giờ cuối đời, họ sẽ trải qua như thế nào?
 (CÓ QUÀ TẶNG) BOOKMARK BẾ HÌNH NHÂN VẬT, KẸP TRONG SÁCH CÓ BỌC MÀNG CO Giá sản phẩm trên Tiki đã bao gồm thuế theo luật hiện hành. Bên cạnh đó, tuỳ vào loại sản phẩm, hình thức và địa chỉ giao hàng mà có thể phát sinh thêm chi phí khác như phí vận chuyển, phụ phí hàng cồng kềnh, thuế nhập khẩu (đối với đơn hàng giao từ nước ngoài có giá trị trên 1 triệu đồng)....."
"206308045","Tại giải đấu bài với phần thưởng là quyền được thách đấu Kaiser Ryo, Judai và các bạn bắt đầu bước vào những trận đấu kịch tính để giành phần thưởng đó. Cùng lúc ấy, Mac và 
 Rabb, hai du học sinh đến từ Hoa Kì cũng tham gia giải đấu, ngấm ngầm tìm kiếm thẻ bài ẩn chứa tinh linh…!? 
 Kazuki Takahashi  
 “Tuy “Yu-Gi-Oh! GX” bản hoạt hình đã khép lại, nhưng hành trình của Judai và những người bạn vẫn tiếp tục ở bản truyện tranh. Bắt đầu từ tháng 4 năm 2008, phần hoạt hình mới mang tên “Yu-Gi-Oh! 5D’s” sẽ bắt đầu, nên mọi người cũng hãy tiếp tục ủng hộ cậu 
 Kageyama nhé. Cảm ơn rất nhiều!” 
 Naoyuki Kageyama 
 “Tựa đề của tác phẩm này là “Yu-Gi-Oh! GX”. Một khi đã gắn với cái tên “Yu-Gi-Oh!”, tôi muốn tận dụng những thiết lập gốc của nguyên tác nên đã sử dụng chi tiết “bàn đá và 
 linh hồn Ka”. Ngẫm lại mới thấy bản thân đã gắn bó với “Yu-Gi-Oh!” được 10 năm rồi, thời gian trôi qua nhanh thật…” 
 
 Giá sản phẩm trên Tiki đã bao gồm thuế theo luật hiện hành. Bên cạnh đó, tuỳ vào loại sản phẩm, hình thức và địa chỉ giao hàng mà có thể phát sinh thêm chi phí khác như phí vận chuyển, phụ phí hàng cồng kềnh, thuế nhập khẩu (đối với đơn hàng giao từ nước ngoài có giá trị trên 1 triệu đồng)....."
"12055610","Bộ KHOA HỌC KHẮP QUANH TA 
 Thông tin chung bộ sách: 
 Tác giả: Rob Colson 
 Số cuốn: 6 
 Độ tuổi: 9-14+ tuổi 
 “Khoa học khắp quanh ta” là một bộ sách khoa học thường thức. Đến với bộ sách này, các bạn nhỏ được làm quen với nhiều khái niệm ở trường, như các định luật Newton hay các loại lực hấp dẫn, lực đẩy, kéo, v…v… Nhưng bằng hình ảnh minh họa đẹp mắt cùng các ví dụ rất đời thường, các bạn sẽ thấy những kiến thức này không hề khó khăn hay khô khan như trong sách giáo khoa, mà rất thú vị và dễ hiểu! 
 Bộ sách sẽ là bước đệm tuyệt vời để các bạn nhỏ làm quen và chuẩn bị cho những bài học khó trên trường lớp! 
 Về tác giả/NXB: 
 Wayland là một chi nhánh của NXB Hachette nổi tiếng trên thế giới, tập trung chủ yếu vào các dòng sách khoa học, thông tin, cung cấp nguồn tài liệu lý thú và hấp dẫn, dễ tiếp cận để trẻ hào hứng học hỏi hơn. 
 ______ 
 CHI TIẾT TỪNG CUỐN: 
 1. Những vật liệu tuyệt vời 
 Sách dành cho độ tuổi 9-14+ 
 Thế giới đầy vật liệu 
 Các trạng thái khác nhau của vật chất là gì? Làm cách nào để đốt một vật? Chuyện gì xảy ra khi bạn nấu ăn? 
 Cùng tìm hiểu về chất rắn, chất lỏng và chất khí và cách vật chất chuyển từ trạng thái này sang trạng thái. Bạn sẽ biết các vật liệu được trộn lẫn để tạo ra tài nguyên mới bằng cách nào. 
 2. Hiểu hết về lực 
 Sách dành cho độ tuổi 9-14+ 
 Thế giới chuyển động 
 Trọng lực khiến Trái Đất xoay quanh Mặt Trời như thế nào? Xe đua làm cách nào để giảm tốc độ? Bạn có biết điều gì làm giảm ma sát không? 
 Cùng tìm hiểu về khối lượng, máy móc và các loại lực để xem chúng điều khiển ta như thế nào. Bạn sẽ biết các loại lực đã giúp cuộc sống ta dễ dàng hơn biết bao! 
 3. Siêu giác quan 
 Sách dành cho độ tuổi 9-14+ 
 Cảm nhận thế giới 
 Bạn cảm thấy thế nào? Trong tai bạn có gì? Gai vị giác của bạn nằm ở đâu? 
 Cùng tìm hiểu về các giác quan và cách cơ thể ta sử dụng chúng. Bạn sẽ biết từng bộ phận riêng biệt của cơ thể thu thập tín hiệu bằng cách nào, nhờ thế mà giúp bạn nhận biết được thế giới xung quanh. 
 4. Hành tinh của chúng ta 
 Sách dành cho độ tuổi 9-14+ 
 Cuộc sống trên Trái Đất 
 Tại sao các bông hoa thu hút côn trùng? Cá thở dưới nước như thế nào? Những loài động vật nào biết bay? 
 Cùng tìm hiểu về những sinh vật sống đa dạng trên Trái Đất và xem cách chúng tiến hóa suốt quá trình sinh tồn nhé! 
 5. Thế giới kỳ diệu 
 Sách dành cho độ tuổi 9-14+ 
 Tìm hiểu vũ trụ 
 Mặt Trời tỏa sáng bằng cách nào? Thứ gì nằm ở trung tâm của thiên hà chúng ta? Vì sao sao chổi lại có chiếc đuôi dài sáng rực? 
 Cùng tìm hiểu về các hành tinh, mặt trăng và các vì sao để biết cách chúng ra đời, cách ta nghiên cứu chúng. Liệu còn sinh vật sống nào trong vũ trụ bao la kia không nhỉ? 
 6. Nhiên liệu 
 Sách dành cho độ tuổi 9-14+ 
 Khởi động cả thế giới 
 Hiệu ứng nhà kính ảnh hưởng tới hành tinh của ta như thế nào? Chuyện gì xảy ra trong nhà máy phản ứng hạt nhân? Nam châm sẽ giúp tạo ra điện bằng cách nào nhỉ? 
 Cùng tìm hiểu về năng lượng và nhiên liệu, bạn sẽ biết chúng giúp ta sinh hoạt và di chuyển như thế nào! Giá sản phẩm trên Tiki đã bao gồm thuế theo luật hiện hành. Bên cạnh đó, tuỳ vào loại sản phẩm, hình thức và địa chỉ giao hàng mà có thể phát sinh thêm chi phí khác như phí vận chuyển, phụ phí hàng cồng kềnh, thuế nhập khẩu (đối với đơn hàng giao từ nước ngoài có giá trị trên 1 triệu đồng)....."
